{"schema_version":"1","bundle_version":"1","digest":"sha256:a83e5f4e22268f7ac04aa1e9f1510ae1ccaf7f9471ad49e16c993790c59cd4fa","manifests":[{"name":"system.echo","version":"1","digest":"sha256:121bd222a685d3f37c311df6279b3139ec7cbc2b6c908e8b207a83b4166f2d4c","category":"system","description":"Returns the supplied JSON value unchanged.","execution_context":"none","side_effects":"pure","timeout":{"default_ms":1000,"maximum_ms":5000},"input_schema":{},"output_schema":{},"resource_policy":{},"artifacts":{},"redaction":{},"retry":{"allowed_failures":["agent_lost"]},"telemetry":{"dimensions":["duration_ms"]}},{"name":"validate.output","version":"1","digest":"sha256:fe7c5808df6ad90ed080a4042ffd0b102d34dc338610ec1fb528453820e76c83","category":"validate","description":"Validates a value against a schema and bounded data-quality rules.","execution_context":"none","side_effects":"pure","timeout":{"default_ms":1000,"maximum_ms":5000},"input_schema":{"type":"object","properties":{"rules":{"type":"object","properties":{"max_records":{"type":"integer","minimum":0},"min_records":{"type":"integer","minimum":0},"non_empty":{"type":"boolean"},"required_fields":{"type":"array","items":{"type":"string","minLength":1}}},"additionalProperties":false},"schema":{"type":"object","additionalProperties":true},"value":{},"value_from":{}},"additionalProperties":false},"output_schema":{"type":"object","required":["valid","violations"],"properties":{"valid":{"type":"boolean"},"violations":{"type":"array","items":{"type":"string"}}},"additionalProperties":false},"resource_policy":{},"artifacts":{},"redaction":{},"retry":{},"telemetry":{"dimensions":["duration_ms"]}}]}
